id,title,thumbnail,duration,compiled,uploaded,file
z6sz0k,People sending voice messages instead of texting is annoying,/__w/ttsvibelounge/ttsvibelounge/videos/z6sz0k_People_sending_voice_messages_instead_of_texting_i/thumbnail_0.png,591.69,False,True,videos/z6sz0k_People_sending_voice_messages_instead_of_texting_i/final.mp4
z78r84,"If you invented a car that ran on stupidity, where would you go to refuel?",/__w/ttsvibelounge/ttsvibelounge/videos/z78r84_If_you_invented_a_car_that_ran_on_stupidity_where_/thumbnail_0.png,454.18999999999977,False,True,videos/z78r84_If_you_invented_a_car_that_ran_on_stupidity_where_/final.mp4
z77wvz,What's the most disgusting thing you've seen someone do with no shame ?,/__w/ttsvibelounge/ttsvibelounge/videos/z77wvz_Whats_the_most_disgusting_thing_youve_seen_someone/thumbnail_0.png,595.99,False,True,videos/z77wvz_Whats_the_most_disgusting_thing_youve_seen_someone/final.mp4
z7i0rx,The standard of dress for adults in North America is way too casual.,/__w/ttsvibelounge/ttsvibelounge/videos/z7i0rx_The_standard_of_dress_for_adults_in_North_America_/thumbnail_0.png,597.3900000000003,False,True,videos/z7i0rx_The_standard_of_dress_for_adults_in_North_America_/final.mp4
z7ywdb,Who is the GOAT stand up comedian?,/__w/ttsvibelounge/ttsvibelounge/videos/z7ywdb_Who_is_the_GOAT_stand_up_comedian/thumbnail_0.png,128.62,False,True,videos/z7ywdb_Who_is_the_GOAT_stand_up_comedian/final.mp4
z8ecob,Who is the female vocal equivalent of Morgan Freeman?,/__w/ttsvibelounge/ttsvibelounge/videos/z8ecob_Who_is_the_female_vocal_equivalent_of_Morgan_Freem/thumbnail_0.png,403.5700000000001,False,True,videos/z8ecob_Who_is_the_female_vocal_equivalent_of_Morgan_Freem/final.mp4
z831cs,People are ridiculously cruel to fat women,/__w/ttsvibelounge/ttsvibelounge/videos/z831cs_People_are_ridiculously_cruel_to_fat_women/thumbnail_0.png,593.24,False,True,videos/z831cs_People_are_ridiculously_cruel_to_fat_women/final.mp4
z8cd61,What celebrity do you think is evil in their soul?,/__w/ttsvibelounge/ttsvibelounge/videos/z8cd61_What_celebrity_do_you_think_is_evil_in_their_soul/thumbnail_0.png,555.0600000000001,False,True,videos/z8cd61_What_celebrity_do_you_think_is_evil_in_their_soul/final.mp4
z8qgky,What food do people mistakenly consider healthy?,/__w/ttsvibelounge/ttsvibelounge/videos/z8qgky_What_food_do_people_mistakenly_consider_healthy/thumbnail_0.png,277.44000000000005,False,True,videos/z8qgky_What_food_do_people_mistakenly_consider_healthy/final.mp4
z8pj4x,Was there anyone who tried to warn us about something that happened but we didn’t listen? Who?,/__w/ttsvibelounge/ttsvibelounge/videos/z8pj4x_Was_there_anyone_who_tried_to_warn_us_about_someth/thumbnail_0.png,595.75,False,True,videos/z8pj4x_Was_there_anyone_who_tried_to_warn_us_about_someth/final.mp4
z90cj0,"Considering how much our gut affects our brain, food itself is psychoactive",/__w/ttsvibelounge/ttsvibelounge/videos/z90cj0_Considering_how_much_our_gut_affects_our_brain_foo/thumbnail_0.png,493.64000000000016,False,True,videos/z90cj0_Considering_how_much_our_gut_affects_our_brain_foo/final.mp4
z9jnr1,What’s the most boring movie you’ve ever seen?,/__w/ttsvibelounge/ttsvibelounge/videos/z9jnr1_Whats_the_most_boring_movie_youve_ever_seen/thumbnail_0.png,448.68,False,True,videos/z9jnr1_Whats_the_most_boring_movie_youve_ever_seen/final.mp4
z9v29l,Having 1 gay dad is far rarer than having 2 gay dads,/__w/ttsvibelounge/ttsvibelounge/videos/z9v29l_Having_1_gay_dad_is_far_rarer_than_having_2_gay_da/thumbnail_0.png,591.8700000000002,False,True,videos/z9v29l_Having_1_gay_dad_is_far_rarer_than_having_2_gay_da/final.mp4
z9kvpg,Is the Russian invasion actually going as badly as the western media portrays it to be?,/__w/ttsvibelounge/ttsvibelounge/videos/z9kvpg_Is_the_Russian_invasion_actually_going_as_badly_as/thumbnail_0.png,594.5200000000001,False,True,videos/z9kvpg_Is_the_Russian_invasion_actually_going_as_badly_as/final.mp4
za33bh,Boss said I can’t bring in nice lunches anymore,/__w/ttsvibelounge/ttsvibelounge/videos/za33bh_Boss_said_I_cant_bring_in_nice_lunches_anymore/thumbnail_0.png,595.9800000000001,False,True,videos/za33bh_Boss_said_I_cant_bring_in_nice_lunches_anymore/final.mp4
zan362,How could Kanye make it worse?,/__w/ttsvibelounge/ttsvibelounge/videos/zan362_How_could_Kanye_make_it_worse/thumbnail_0.png,530.7500000000002,False,True,videos/zan362_How_could_Kanye_make_it_worse/final.mp4
zakvw7,What is a gender specific policy that your company has that you are ok with.,/__w/ttsvibelounge/ttsvibelounge/videos/zakvw7_What_is_a_gender_specific_policy_that_your_company/thumbnail_0.png,587.4,False,True,videos/zakvw7_What_is_a_gender_specific_policy_that_your_company/final.mp4
zavx0s,which celebrity do you think was unfairly cancelled?,/__w/ttsvibelounge/ttsvibelounge/videos/zavx0s_which_celebrity_do_you_think_was_unfairly_cancelle/thumbnail_0.png,414.94,False,True,videos/zavx0s_which_celebrity_do_you_think_was_unfairly_cancelle/final.mp4
zavs73,Where do I start with showing an elderly woman the internet?,/__w/ttsvibelounge/ttsvibelounge/videos/zavs73_Where_do_I_start_with_showing_an_elderly_woman_the/thumbnail_0.png,598.2599999999998,False,True,videos/zavs73_Where_do_I_start_with_showing_an_elderly_woman_the/final.mp4
zbh4ac, Illegal Strikes  the term itself violates the Constitution and threatens every American.,/__w/ttsvibelounge/ttsvibelounge/videos/zbh4ac_Illegal_Strikes_the_term_itself_violates_the_Const/thumbnail_0.png,587.7299999999999,False,True,videos/zbh4ac_Illegal_Strikes_the_term_itself_violates_the_Const/final.mp4
zbjbpq,"Gamers of Reddit, what video game has the best storyline?",/__w/ttsvibelounge/ttsvibelounge/videos/zbjbpq_Gamers_of_Reddit_what_video_game_has_the_best_stor/thumbnail_0.png,403.8399999999999,False,True,videos/zbjbpq_Gamers_of_Reddit_what_video_game_has_the_best_stor/final.mp4
zbnr9g,The amount of times you see a butthole in your lifetime increases dramatically with having kids.,/__w/ttsvibelounge/ttsvibelounge/videos/zbnr9g_The_amount_of_times_you_see_a_butthole_in_your_lif/thumbnail_0.png,592.7,False,True,videos/zbnr9g_The_amount_of_times_you_see_a_butthole_in_your_lif/final.mp4
zbw659,What are you convinced people are pretending to enjoy?,/__w/ttsvibelounge/ttsvibelounge/videos/zbw659_What_are_you_convinced_people_are_pretending_to_en/thumbnail_0.png,469.4599999999999,False,True,videos/zbw659_What_are_you_convinced_people_are_pretending_to_en/final.mp4
zc7dsc,"If you woke up to find 99.99  of the population disappeared overnight, what would you do?",/__w/ttsvibelounge/ttsvibelounge/videos/zc7dsc_If_you_woke_up_to_find_9999_of_the_population_disa/thumbnail_0.png,599.8500000000001,False,True,videos/zc7dsc_If_you_woke_up_to_find_9999_of_the_population_disa/final.mp4
zcbjca,What is criminally overpriced?,/__w/ttsvibelounge/ttsvibelounge/videos/zcbjca_What_is_criminally_overpriced/thumbnail_0.png,413.22,False,True,videos/zcbjca_What_is_criminally_overpriced/final.mp4
zcaijh,Teenagers before the internet  what did you do in your room during your spare time?,/__w/ttsvibelounge/ttsvibelounge/videos/zcaijh_Teenagers_before_the_internet_what_did_you_do_in_y/thumbnail_0.png,596.79,False,True,videos/zcaijh_Teenagers_before_the_internet_what_did_you_do_in_y/final.mp4
zcvgvb,"If you eat 15,000 calories in a day, you get $1B. How do you get it done?",/__w/ttsvibelounge/ttsvibelounge/videos/zcvgvb_If_you_eat_15000_calories_in_a_day_you_get_1B_How_/thumbnail_0.png,597.66,False,True,videos/zcvgvb_If_you_eat_15000_calories_in_a_day_you_get_1B_How_/final.mp4
zd6pxv,"What's something we all just pretend no one does, but in truth we know we all do it?",/__w/ttsvibelounge/ttsvibelounge/videos/zd6pxv_Whats_something_we_all_just_pretend_no_one_does_bu/thumbnail_0.png,435.58,False,True,videos/zd6pxv_Whats_something_we_all_just_pretend_no_one_does_bu/final.mp4
zd5uj9,"Married Men, what are the unspoken rules for successful marriage?",/__w/ttsvibelounge/ttsvibelounge/videos/zd5uj9_Married_Men_what_are_the_unspoken_rules_for_succes/thumbnail_0.png,588.9200000000002,False,True,videos/zd5uj9_Married_Men_what_are_the_unspoken_rules_for_succes/final.mp4
zdfnfp,Why do some workers want to go back to the office?,/__w/ttsvibelounge/ttsvibelounge/videos/zdfnfp_Why_do_some_workers_want_to_go_back_to_the_office/thumbnail_0.png,595.05,False,True,videos/zdfnfp_Why_do_some_workers_want_to_go_back_to_the_office/final.mp4
zcuxw2,Do you fart around your significant other?,/__w/ttsvibelounge/ttsvibelounge/videos/zcuxw2_Do_you_fart_around_your_significant_other/thumbnail_0.png,584.82,False,True,videos/zcuxw2_Do_you_fart_around_your_significant_other/final.mp4
zdw7xx,Being a truck driver for a company that transports eggs must be an extremely stressful job,/__w/ttsvibelounge/ttsvibelounge/videos/zdw7xx_Being_a_truck_driver_for_a_company_that_transports/thumbnail_0.png,589.1000000000003,False,True,videos/zdw7xx_Being_a_truck_driver_for_a_company_that_transports/final.mp4
zehpy2,Dyed my hair blue so boss would stop blaming me for hair in customer's food,/__w/ttsvibelounge/ttsvibelounge/videos/zehpy2_Dyed_my_hair_blue_so_boss_would_stop_blaming_me_fo/thumbnail_0.png,593.9100000000001,False,True,videos/zehpy2_Dyed_my_hair_blue_so_boss_would_stop_blaming_me_fo/final.mp4
zegkj7,What’s the best Christmas movie of all time ?,/__w/ttsvibelounge/ttsvibelounge/videos/zegkj7_Whats_the_best_Christmas_movie_of_all_time_/thumbnail_0.png,115.66,False,True,videos/zegkj7_Whats_the_best_Christmas_movie_of_all_time_/final.mp4
zeixmg,I’m working full time for the first time in my life. Is it supposed to feel THIS dreadful?,/__w/ttsvibelounge/ttsvibelounge/videos/zeixmg_Im_working_fulltime_for_the_first_time_in_my_life_/thumbnail_0.png,600.53,False,True,videos/zeixmg_Im_working_fulltime_for_the_first_time_in_my_life_/final.mp4
zeuksw,What should you never do in the United States?,/__w/ttsvibelounge/ttsvibelounge/videos/zeuksw_What_should_you_never_do_in_the_United_States/thumbnail_0.png,349.4700000000001,False,True,videos/zeuksw_What_should_you_never_do_in_the_United_States/final.mp4
zfew2z,Whats a hobby someone can have that is an immediate red flag?,/__w/ttsvibelounge/ttsvibelounge/videos/zfew2z_Whats_a_hobby_someone_can_have_that_is_an_immediat/thumbnail_0.png,432.0799999999999,False,True,videos/zfew2z_Whats_a_hobby_someone_can_have_that_is_an_immediat/final.mp4
zf28sj,Why is it that all the news on trans people seem to always revolve around trans women?,/__w/ttsvibelounge/ttsvibelounge/videos/zf28sj_Why_is_it_that_all_the_news_on_trans_people_seem_t/thumbnail_0.png,597.0500000000001,False,True,videos/zf28sj_Why_is_it_that_all_the_news_on_trans_people_seem_t/final.mp4
zf30pj,Created a point of interest on Google Maps to piss off wealthy Karen neighbors,/__w/ttsvibelounge/ttsvibelounge/videos/zf30pj_Created_a_pointofinterest_on_Google_Maps_to_piss_o/thumbnail_0.png,599.1100000000002,False,True,videos/zf30pj_Created_a_pointofinterest_on_Google_Maps_to_piss_o/final.mp4
zfwkd6,"Men of Reddit, what is something us women do that baffles you?",/__w/ttsvibelounge/ttsvibelounge/videos/zfwkd6_Men_of_Reddit_what_is_something_us_women_do_that_b/thumbnail_0.png,553.8800000000001,False,True,videos/zfwkd6_Men_of_Reddit_what_is_something_us_women_do_that_b/final.mp4
zfzpgg,Why did the US trade Britney Griner for an international arms dealer?,/__w/ttsvibelounge/ttsvibelounge/videos/zfzpgg_Why_did_the_US_trade_Britney_Griner_for_an_interna/thumbnail_0.png,574.45,False,True,videos/zfzpgg_Why_did_the_US_trade_Britney_Griner_for_an_interna/final.mp4
zg6h2s,I tipped my exfriend and bully as petty revenge,/__w/ttsvibelounge/ttsvibelounge/videos/zg6h2s_I_tipped_my_exfriend_and_bully_as_petty_revenge/thumbnail_0.png,600.0000000000001,False,True,videos/zg6h2s_I_tipped_my_exfriend_and_bully_as_petty_revenge/final.mp4
zgfmf2,Which celebrities are distractingly attractive?,/__w/ttsvibelounge/ttsvibelounge/videos/zgfmf2_Which_celebrities_are_distractingly_attractive/thumbnail_0.png,473.2299999999999,False,True,videos/zgfmf2_Which_celebrities_are_distractingly_attractive/final.mp4
zgozro,Taking pictures of people on the street is considered less creepy the more expensive your camera is,/__w/ttsvibelounge/ttsvibelounge/videos/zgozro_Taking_pictures_of_people_on_the_street_is_conside/thumbnail_0.png,599.72,False,True,videos/zgozro_Taking_pictures_of_people_on_the_street_is_conside/final.mp4
zgz5sh,Wikipedia is one of the few examples of everyone working together and it actually turning out well,/__w/ttsvibelounge/ttsvibelounge/videos/zgz5sh_Wikipedia_is_one_of_the_few_examples_of_everyone_w/thumbnail_0.png,600.7400000000001,False,True,videos/zgz5sh_Wikipedia_is_one_of_the_few_examples_of_everyone_w/final.mp4
zh6ift,What is the best sitcom ever?,/__w/ttsvibelounge/ttsvibelounge/videos/zh6ift_What_is_the_best_sitcom_ever/thumbnail_0.png,175.73999999999998,False,True,videos/zh6ift_What_is_the_best_sitcom_ever/final.mp4
zhbpsi,Am I Pathetic Because I Go Out to Eat By Myself At Least 2 Nights a Week?,/__w/ttsvibelounge/ttsvibelounge/videos/zhbpsi_Am_I_Pathetic_Because_I_Go_Out_to_Eat_By_Myself_At/thumbnail_0.png,593.4700000000003,False,True,videos/zhbpsi_Am_I_Pathetic_Because_I_Go_Out_to_Eat_By_Myself_At/final.mp4
zhp9r1,What's a women's thing men should absolutely start doing?,/__w/ttsvibelounge/ttsvibelounge/videos/zhp9r1_Whats_a_womens_thing_men_should_absolutely_start_d/thumbnail_0.png,402.2899999999999,False,True,videos/zhp9r1_Whats_a_womens_thing_men_should_absolutely_start_d/final.mp4
zhra74,Does anyone else think the Elf on a Shelf thing is weird as hell?,/__w/ttsvibelounge/ttsvibelounge/videos/zhra74_Does_anyone_else_think_the_Elf_on_a_Shelf_thing_is/thumbnail_0.png,581.96,False,True,videos/zhra74_Does_anyone_else_think_the_Elf_on_a_Shelf_thing_is/final.mp4
zi7edc,What's one of life's biggest traps that people fall into?,/__w/ttsvibelounge/ttsvibelounge/videos/zi7edc_Whats_one_of_lifes_biggest_traps_that_people_fall_/thumbnail_0.png,587.3499999999999,False,True,videos/zi7edc_Whats_one_of_lifes_biggest_traps_that_people_fall_/final.mp4
zihq3c,"It's okay to tell someone they sound tired, but telling someone they look tired is risky.",/__w/ttsvibelounge/ttsvibelounge/videos/zihq3c_Its_okay_to_tell_someone_they_sound_tired_but_tell/thumbnail_0.png,400.75,False,True,videos/zihq3c_Its_okay_to_tell_someone_they_sound_tired_but_tell/final.mp4
ziqmsh,What dark secret are you hiding from everyone?,/__w/ttsvibelounge/ttsvibelounge/videos/ziqmsh_What_dark_secret_are_you_hiding_from_everyone/thumbnail_0.png,595.52,False,True,videos/ziqmsh_What_dark_secret_are_you_hiding_from_everyone/final.mp4
zizl40,I’ve had enough so much I pulled a knife on a train creeper,/__w/ttsvibelounge/ttsvibelounge/videos/zizl40_Ive_had_enough_so_much_I_pulled_a_knife_on_a_train/thumbnail_0.png,600.41,False,True,videos/zizl40_Ive_had_enough_so_much_I_pulled_a_knife_on_a_train/final.mp4
zjems5,What famous person needs to be ignored and shunned into obscurity ?,/__w/ttsvibelounge/ttsvibelounge/videos/zjems5_What_famous_person_needs_to_be_ignored_and_shunned/thumbnail_0.png,334.4700000000001,False,True,videos/zjems5_What_famous_person_needs_to_be_ignored_and_shunned/final.mp4
zitrcj,"Drivers who stop to let others go aren't being nice, they're making the road less safe for everyone.",/__w/ttsvibelounge/ttsvibelounge/videos/zitrcj_Drivers_who_stop_to_let_others_go_arent_being_nice/thumbnail_0.png,576.54,False,True,videos/zitrcj_Drivers_who_stop_to_let_others_go_arent_being_nice/final.mp4
zj1oi1,I replied to a condescending comment in kind,/__w/ttsvibelounge/ttsvibelounge/videos/zj1oi1_I_replied_to_a_condescending_comment_in_kind/thumbnail_0.png,594.53,False,True,videos/zj1oi1_I_replied_to_a_condescending_comment_in_kind/final.mp4
zkazoj,Mowing your lawn is an exclusively middle class chore. Neither the poor nor the rich have to do it.,/__w/ttsvibelounge/ttsvibelounge/videos/zkazoj_Mowing_your_lawn_is_an_exclusively_middleclass_cho/thumbnail_0.png,596.64,False,True,videos/zkazoj_Mowing_your_lawn_is_an_exclusively_middleclass_cho/final.mp4
zk8wn9,"Not using 1 10, how attractive are you?",/__w/ttsvibelounge/ttsvibelounge/videos/zk8wn9_Not_using_110_how_attractive_are_you/thumbnail_0.png,590.5999999999999,False,True,videos/zk8wn9_Not_using_110_how_attractive_are_you/final.mp4
zko68g,Being too lazy to go out for junk food is an example of 2 negatives becoming a positive.,/__w/ttsvibelounge/ttsvibelounge/videos/zko68g_Being_too_lazy_to_go_out_for_junk_food_is_an_examp/thumbnail_0.png,520.1300000000002,False,True,videos/zko68g_Being_too_lazy_to_go_out_for_junk_food_is_an_examp/final.mp4
zk51af,Why would Dave Chappelle bring Elon Musk on stage?,/__w/ttsvibelounge/ttsvibelounge/videos/zk51af_Why_would_Dave_Chappelle_bring_Elon_Musk_on_stage/thumbnail_0.png,600.0099999999999,False,True,videos/zk51af_Why_would_Dave_Chappelle_bring_Elon_Musk_on_stage/final.mp4
zkwh2u,I dated a self proclaimed  nice guy ,/__w/ttsvibelounge/ttsvibelounge/videos/zkwh2u_I_dated_a_selfproclaimed_nice_guy/thumbnail_0.png,594.1600000000001,False,True,videos/zkwh2u_I_dated_a_selfproclaimed_nice_guy/final.mp4
zl70el,"Was caught with a coffee cup at work, the next day everyone’s  water privileges  were revoked.",/__w/ttsvibelounge/ttsvibelounge/videos/zl70el_Was_caught_with_a_coffee_cup_at_work_the_next_day_/thumbnail_0.png,599.86,False,True,videos/zl70el_Was_caught_with_a_coffee_cup_at_work_the_next_day_/final.mp4
zlzgd7,Boyfriend  says misogynistic things like  women who can’t have children are useless ,/__w/ttsvibelounge/ttsvibelounge/videos/zlzgd7_Boyfriend_26m_says_misogynistic_things_like_women_/thumbnail_0.png,585.7900000000002,False,True,videos/zlzgd7_Boyfriend_26m_says_misogynistic_things_like_women_/final.mp4
zm4u9z,"US wants to ban TikTok, what are your thoughts?",/__w/ttsvibelounge/ttsvibelounge/videos/zm4u9z_US_wants_to_ban_TikTok_what_are_your_thoughts/thumbnail_0.png,595.4699999999999,False,True,videos/zm4u9z_US_wants_to_ban_TikTok_what_are_your_thoughts/final.mp4
zmh9u8,To Americans who are Against Free Healthcare. Why?,/__w/ttsvibelounge/ttsvibelounge/videos/zmh9u8_To_Americans_who_are_Against_Free_Healthcare_Why/thumbnail_0.png,586.4099999999999,False,True,videos/zmh9u8_To_Americans_who_are_Against_Free_Healthcare_Why/final.mp4
zmtduw,What TV Show had the worst ending?,/__w/ttsvibelounge/ttsvibelounge/videos/zmtduw_What_TV_Show_had_the_worst_ending/thumbnail_0.png,424.66,False,True,videos/zmtduw_What_TV_Show_had_the_worst_ending/final.mp4
zmpivy,Parents who charge their teenagers rent should be charged rent when their older and live with them,/__w/ttsvibelounge/ttsvibelounge/videos/zmpivy_Parents_who_charge_their_teenagers_rent_should_be_/thumbnail_0.png,597.45,False,True,videos/zmpivy_Parents_who_charge_their_teenagers_rent_should_be_/final.mp4
znexhp,what screams insecurity but most people don't realize?,/__w/ttsvibelounge/ttsvibelounge/videos/znexhp_what_screams_insecurity_but_most_people_dont_reali/thumbnail_0.png,570.3600000000001,False,True,videos/znexhp_what_screams_insecurity_but_most_people_dont_reali/final.mp4
znnrcu,A cashier saved me $10 with her antiwork attitude so I filled out the customer service survey.,/__w/ttsvibelounge/ttsvibelounge/videos/znnrcu_A_cashier_saved_me_10_with_her_antiwork_attitude_s/thumbnail_0.png,593.92,False,True,videos/znnrcu_A_cashier_saved_me_10_with_her_antiwork_attitude_s/final.mp4
zntmlm,Those who believe in a flat earth don't tell us what it looks like on the underside.,/__w/ttsvibelounge/ttsvibelounge/videos/zntmlm_Those_who_believe_in_a_flat_earth_dont_tell_us_wha/thumbnail_0.png,597.5200000000001,False,True,videos/zntmlm_Those_who_believe_in_a_flat_earth_dont_tell_us_wha/final.mp4
zo6zuv,If you had the ability to bring back a Canceled Series what would it be?,/__w/ttsvibelounge/ttsvibelounge/videos/zo6zuv_If_you_had_the_ability_to_bring_back_a_Canceled_Se/thumbnail_0.png,276.8,False,True,videos/zo6zuv_If_you_had_the_ability_to_bring_back_a_Canceled_Se/final.mp4
zogzkb,Showing someone your music collection is a very intimate act.,/__w/ttsvibelounge/ttsvibelounge/videos/zogzkb_Showing_someone_your_music_collection_is_a_very_in/thumbnail_0.png,595.9300000000001,False,True,videos/zogzkb_Showing_someone_your_music_collection_is_a_very_in/final.mp4
zofpia,Stop asking me if we can switch seats on an airplane,/__w/ttsvibelounge/ttsvibelounge/videos/zofpia_Stop_asking_me_if_we_can_switch_seats_on_an_airpla/thumbnail_0.png,597.94,False,True,videos/zofpia_Stop_asking_me_if_we_can_switch_seats_on_an_airpla/final.mp4
zo9ppz,Guy from a dating app unleashed his incel misogyny on me,/__w/ttsvibelounge/ttsvibelounge/videos/zo9ppz_Guy_from_a_dating_app_unleashed_his_incel_misogyny/thumbnail_0.png,600.0900000000001,False,True,videos/zo9ppz_Guy_from_a_dating_app_unleashed_his_incel_misogyny/final.mp4
zoynqc,What was ruined because too many people did it?,/__w/ttsvibelounge/ttsvibelounge/videos/zoynqc_What_was_ruined_because_too_many_people_did_it/thumbnail_0.png,595.81,False,True,videos/zoynqc_What_was_ruined_because_too_many_people_did_it/final.mp4
zozupu,"Dick learns  you take a pic of me, I take a pic of you.",/__w/ttsvibelounge/ttsvibelounge/videos/zozupu_Dick_learns_you_take_a_pic_of_me_I_take_a_pic_of_y/thumbnail_0.png,596.6400000000001,False,True,videos/zozupu_Dick_learns_you_take_a_pic_of_me_I_take_a_pic_of_y/final.mp4
zp000r,The  he finally asked  posts make my blood boil,/__w/ttsvibelounge/ttsvibelounge/videos/zp000r_The_he_finally_asked_posts_make_my_blood_boil/thumbnail_0.png,594.2999999999998,False,True,videos/zp000r_The_he_finally_asked_posts_make_my_blood_boil/final.mp4
zpo3so,"What is so ridiculously overpriced, yet you still buy?",/__w/ttsvibelounge/ttsvibelounge/videos/zpo3so_What_is_so_ridiculously_overpriced_yet_you_still_b/thumbnail_0.png,379.2899999999999,False,True,videos/zpo3so_What_is_so_ridiculously_overpriced_yet_you_still_b/final.mp4
zpu1jc, A Degree Won't Keep You Warm at Night ,/__w/ttsvibelounge/ttsvibelounge/videos/zpu1jc_A_Degree_Wont_Keep_You_Warm_at_Night/thumbnail_0.png,598.4599999999999,False,True,videos/zpu1jc_A_Degree_Wont_Keep_You_Warm_at_Night/final.mp4
zqaipu,It’s concerning that having real ingredients in food products is a marketing and selling point.,/__w/ttsvibelounge/ttsvibelounge/videos/zqaipu_Its_concerning_that_having_real_ingredients_in_foo/thumbnail_0.png,600.51,False,True,videos/zqaipu_Its_concerning_that_having_real_ingredients_in_foo/final.mp4
zppkqv,What joke is starting to get old now?,/__w/ttsvibelounge/ttsvibelounge/videos/zppkqv_What_joke_is_starting_to_get_old_now/thumbnail_0.png,428.1600000000001,False,True,videos/zppkqv_What_joke_is_starting_to_get_old_now/final.mp4
zppb1q,I put salt in my drinks to find out who's been stealing them,/__w/ttsvibelounge/ttsvibelounge/videos/zppb1q_I_put_salt_in_my_drinks_to_find_out_whos_been_stea/thumbnail_0.png,598.5300000000001,False,True,videos/zppb1q_I_put_salt_in_my_drinks_to_find_out_whos_been_stea/final.mp4
zquyhv,what was ruined by rich people?,/__w/ttsvibelounge/ttsvibelounge/videos/zquyhv_what_was_ruined_by_rich_people/thumbnail_0.png,598.2199999999998,False,True,videos/zquyhv_what_was_ruined_by_rich_people/final.mp4
zr5en3,"If the US can give Ukraine over 45 billion dollars, why cant they nationalize healthcare?",/__w/ttsvibelounge/ttsvibelounge/videos/zr5en3_If_the_US_can_give_Ukraine_over_45_billion_dollars/thumbnail_0.png,593.2400000000001,False,True,videos/zr5en3_If_the_US_can_give_Ukraine_over_45_billion_dollars/final.mp4
zqyeyg,There are literally no reasons to choose an iPhone over an Android smartphone,/__w/ttsvibelounge/ttsvibelounge/videos/zqyeyg_There_are_literally_no_reasons_to_choose_an_iPhone/thumbnail_0.png,585.25,False,True,videos/zqyeyg_There_are_literally_no_reasons_to_choose_an_iPhone/final.mp4
zqzryv,There wouldn't be any billionaires if billionaires behaved like people wanted.,/__w/ttsvibelounge/ttsvibelounge/videos/zqzryv_There_wouldnt_be_any_billionaires_if_billionaires_/thumbnail_0.png,592.6899999999999,False,True,videos/zqzryv_There_wouldnt_be_any_billionaires_if_billionaires_/final.mp4
zr5b03,Americans of reddit what would you do if the United states were invaded ?,/__w/ttsvibelounge/ttsvibelounge/videos/zr5b03_Americans_of_reddit_what_would_you_do_if_the_Unite/thumbnail_0.png,594.57,False,True,videos/zr5b03_Americans_of_reddit_what_would_you_do_if_the_Unite/final.mp4
zrumbs,Some of the dumbest people I've met were doctors.,/__w/ttsvibelounge/ttsvibelounge/videos/zrumbs_Some_of_the_dumbest_people_Ive_met_were_doctors/thumbnail_0.png,580.8400000000001,False,True,videos/zrumbs_Some_of_the_dumbest_people_Ive_met_were_doctors/final.mp4
zs7zys,my boss refused to let me buy a box of pads during my shift,/__w/ttsvibelounge/ttsvibelounge/videos/zs7zys_my_boss_refused_to_let_me_buy_a_box_of_pads_during/thumbnail_0.png,595.8299999999998,False,True,videos/zs7zys_my_boss_refused_to_let_me_buy_a_box_of_pads_during/final.mp4
zshbwg,"If you had the power to shut down a company for good, which company would it be?",/__w/ttsvibelounge/ttsvibelounge/videos/zshbwg_If_you_had_the_power_to_shut_down_a_company_for_go/thumbnail_0.png,553.6100000000002,False,True,videos/zshbwg_If_you_had_the_power_to_shut_down_a_company_for_go/final.mp4
zsmo9z,Can men and woman both get away with this in the work place?,/__w/ttsvibelounge/ttsvibelounge/videos/zsmo9z_Can_men_and_woman_both_get_away_with_this_in_the_w/thumbnail_0.png,599.5699999999999,False,True,videos/zsmo9z_Can_men_and_woman_both_get_away_with_this_in_the_w/final.mp4
zsqivw,What is an american thing but americans think everyone outside of america does it?,/__w/ttsvibelounge/ttsvibelounge/videos/zsqivw_What_is_an_american_thing_but_americans_think_ever/thumbnail_0.png,521.3299999999999,False,True,videos/zsqivw_What_is_an_american_thing_but_americans_think_ever/final.mp4
