id,title,thumbnail,duration,compiled,uploaded,file
zsly6p,I don't think it's rude to ask who the father is when a woman announces her pregnancy.,/__w/ttsvibelounge/ttsvibelounge/videos/zsly6p_I_dont_think_its_rude_to_ask_who_the_father_is_whe/thumbnail_0.png,597.2399999999998,False,True,videos/zsly6p_I_dont_think_its_rude_to_ask_who_the_father_is_whe/final.mp4
zsn9cr,"Cheated on me? Enjoy your speeding tickets, asshole.",/__w/ttsvibelounge/ttsvibelounge/videos/zsn9cr_Cheated_on_me_Enjoy_your_speeding_tickets_asshole/thumbnail_0.png,376.62,False,True,videos/zsn9cr_Cheated_on_me_Enjoy_your_speeding_tickets_asshole/final.mp4
ztfz8s,   my husband will get to just sit there and enjoy himself. ,/__w/ttsvibelounge/ttsvibelounge/videos/ztfz8s_while_my_husband_will_get_to_just_sit_there_and_en/thumbnail_0.png,579.0100000000001,False,True,videos/ztfz8s_while_my_husband_will_get_to_just_sit_there_and_en/final.mp4
ztsagt,What is something acceptable in women but frowned upon in men?,/__w/ttsvibelounge/ttsvibelounge/videos/ztsagt_What_is_something_acceptable_in_women_but_frowned_/thumbnail_0.png,432.5400000000001,False,True,videos/ztsagt_What_is_something_acceptable_in_women_but_frowned_/final.mp4
zte9t7,Leaving your SO because they become physically unattractive to you doesn't make you an asshole.,/__w/ttsvibelounge/ttsvibelounge/videos/zte9t7_Leaving_your_SO_because_they_become_physically_una/thumbnail_0.png,599.9399999999998,False,True,videos/zte9t7_Leaving_your_SO_because_they_become_physically_una/final.mp4
ztfwy6,Why are we calling homeless people unhoused now?,/__w/ttsvibelounge/ttsvibelounge/videos/ztfwy6_Why_are_we_calling_homeless_people_unhoused_now/thumbnail_0.png,592.1900000000002,False,True,videos/ztfwy6_Why_are_we_calling_homeless_people_unhoused_now/final.mp4
zuckzx,What does Europe have that North America does not?,/__w/ttsvibelounge/ttsvibelounge/videos/zuckzx_What_does_Europe_have_that_North_America_does_not/thumbnail_0.png,267.7,False,True,videos/zuckzx_What_does_Europe_have_that_North_America_does_not/final.mp4
zub39m,Women should avoid Andrew Tate followers at all costs,/__w/ttsvibelounge/ttsvibelounge/videos/zub39m_Women_should_avoid_Andrew_Tate_followers_at_all_co/thumbnail_0.png,591.53,False,True,videos/zub39m_Women_should_avoid_Andrew_Tate_followers_at_all_co/final.mp4
zulivg,"Fired from job, gave all company shirts to homeless people in neighborhood",/__w/ttsvibelounge/ttsvibelounge/videos/zulivg_Fired_from_job_gave_all_company_shirts_to_homeless/thumbnail_0.png,586.56,False,True,videos/zulivg_Fired_from_job_gave_all_company_shirts_to_homeless/final.mp4
zuzhgo,What screams  I’m a bad parent ?,/__w/ttsvibelounge/ttsvibelounge/videos/zuzhgo_What_screams_Im_a_bad_parent/thumbnail_0.png,588.0100000000001,False,True,videos/zuzhgo_What_screams_Im_a_bad_parent/final.mp4
zv2cyc,You're officially an adult when it's no longer hard to fall asleep on Christmas Eve,/__w/ttsvibelounge/ttsvibelounge/videos/zv2cyc_Youre_officially_an_adult_when_its_no_longer_hard_/thumbnail_0.png,600.4300000000001,False,True,videos/zv2cyc_Youre_officially_an_adult_when_its_no_longer_hard_/final.mp4
zv4nvo,The magic of Christmas is really just the unrecognized labor of women,/__w/ttsvibelounge/ttsvibelounge/videos/zv4nvo_The_magic_of_Christmas_is_really_just_the_unrecogn/thumbnail_0.png,596.9999999999998,False,True,videos/zv4nvo_The_magic_of_Christmas_is_really_just_the_unrecogn/final.mp4
zv0i55,My mother is an asshole and I have been collecting dirt on her for years,/__w/ttsvibelounge/ttsvibelounge/videos/zv0i55_My_mother_is_an_asshole_and_I_have_been_collecting/thumbnail_0.png,596.86,False,True,videos/zv0i55_My_mother_is_an_asshole_and_I_have_been_collecting/final.mp4
zvcetm,Anyone else feel cheated by Christmas Eve and Christmas happening on a Saturday and Sunday?,/__w/ttsvibelounge/ttsvibelounge/videos/zvcetm_Anyone_else_feel_cheated_by_Christmas_Eve_and_Chri/thumbnail_0.png,596.5899999999999,False,True,videos/zvcetm_Anyone_else_feel_cheated_by_Christmas_Eve_and_Chri/final.mp4
zvpho2, Serious  What crime do you really want to see solved and Justice served?,/__w/ttsvibelounge/ttsvibelounge/videos/zvpho2_Serious_What_crime_do_you_really_want_to_see_solve/thumbnail_0.png,597.39,False,True,videos/zvpho2_Serious_What_crime_do_you_really_want_to_see_solve/final.mp4
zvo2t2,MIL gave me a scale for Christmas,/__w/ttsvibelounge/ttsvibelounge/videos/zvo2t2_MIL_gave_me_a_scale_for_Christmas/thumbnail_0.png,591.7900000000001,False,True,videos/zvo2t2_MIL_gave_me_a_scale_for_Christmas/final.mp4
zvhmp7,You never see old people laying sleeping on their stomach,/__w/ttsvibelounge/ttsvibelounge/videos/zvhmp7_You_never_see_old_people_layingsleeping_on_their_s/thumbnail_0.png,584.9699999999999,False,True,videos/zvhmp7_You_never_see_old_people_layingsleeping_on_their_s/final.mp4
zw93da,"Refuse to give the gift you promised my daughter? Fine, I'll take away the gift I got for you.",/__w/ttsvibelounge/ttsvibelounge/videos/zw93da_Refuse_to_give_the_gift_you_promised_my_daughter_F/thumbnail_0.png,597.5000000000002,False,True,videos/zw93da_Refuse_to_give_the_gift_you_promised_my_daughter_F/final.mp4
zwgoi9,How are people not sick and tired of superhero movies yet?,/__w/ttsvibelounge/ttsvibelounge/videos/zwgoi9_How_are_people_not_sick_and_tired_of_superhero_mov/thumbnail_0.png,595.8099999999998,False,True,videos/zwgoi9_How_are_people_not_sick_and_tired_of_superhero_mov/final.mp4
zwccxb,I saw a quote that said Christmas magic is 90  woman's work that goes unrecognised.,/__w/ttsvibelounge/ttsvibelounge/videos/zwccxb_I_saw_a_quote_that_said_Christmas_magic_is_90_woma/thumbnail_0.png,587.1599999999997,False,True,videos/zwccxb_I_saw_a_quote_that_said_Christmas_magic_is_90_woma/final.mp4
zwwj7v,It’s really awesome that fire burns in the visible light spectrum,/__w/ttsvibelounge/ttsvibelounge/videos/zwwj7v_Its_really_awesome_that_fire_burns_in_the_visible_/thumbnail_0.png,594.8199999999998,False,True,videos/zwwj7v_Its_really_awesome_that_fire_burns_in_the_visible_/final.mp4
zxfxdy,Choosing beggar brother demands thousands of dollars of catered food for wedding,/__w/ttsvibelounge/ttsvibelounge/videos/zxfxdy_Choosing_beggar_brother_demands_thousands_of_dolla/thumbnail_0.png,598.6400000000002,False,True,videos/zxfxdy_Choosing_beggar_brother_demands_thousands_of_dolla/final.mp4
zxbrda,Which celebrity looks like they smell bad?,/__w/ttsvibelounge/ttsvibelounge/videos/zxbrda_Which_celebrity_looks_like_they_smell_bad/thumbnail_0.png,354.11,False,True,videos/zxbrda_Which_celebrity_looks_like_they_smell_bad/final.mp4
zy5kmq,What fact are you Just TIRED of explaining to people?,/__w/ttsvibelounge/ttsvibelounge/videos/zy5kmq_What_fact_are_you_Just_TIRED_of_explaining_to_peop/thumbnail_0.png,587.7199999999998,False,True,videos/zy5kmq_What_fact_are_you_Just_TIRED_of_explaining_to_peop/final.mp4
zxzx64,All the Kardashian babies will grow up to look nothing like their Mums,/__w/ttsvibelounge/ttsvibelounge/videos/zxzx64_All_the_Kardashian_babies_will_grow_up_to_look_not/thumbnail_0.png,368.88999999999993,False,True,videos/zxzx64_All_the_Kardashian_babies_will_grow_up_to_look_not/final.mp4
zyja5x,Andrew Tate arrested in Romania on human trafficking charges,/__w/ttsvibelounge/ttsvibelounge/videos/zyja5x_Andrew_Tate_arrested_in_Romania_on_human_trafficki/thumbnail_0.png,453.02000000000015,False,True,videos/zyja5x_Andrew_Tate_arrested_in_Romania_on_human_trafficki/final.mp4
zyfrs1,What are some things the USA does right?,/__w/ttsvibelounge/ttsvibelounge/videos/zyfrs1_What_are_some_things_the_USA_does_right/thumbnail_0.png,587.6399999999999,False,True,videos/zyfrs1_What_are_some_things_the_USA_does_right/final.mp4
zyeb35,You can become the first an only person to ever pronounce almost any number into the billions,/__w/ttsvibelounge/ttsvibelounge/videos/zyeb35_You_can_become_the_first_an_only_person_to_ever_pr/thumbnail_0.png,594.9999999999998,False,True,videos/zyeb35_You_can_become_the_first_an_only_person_to_ever_pr/final.mp4
zz3pfm,What’s an obvious sign someone’s american?,/__w/ttsvibelounge/ttsvibelounge/videos/zz3pfm_Whats_an_obvious_sign_someones_american/thumbnail_0.png,593.8100000000001,False,True,videos/zz3pfm_Whats_an_obvious_sign_someones_american/final.mp4
zz1br1,Who should young men look up to?,/__w/ttsvibelounge/ttsvibelounge/videos/zz1br1_Who_should_young_men_look_up_to/thumbnail_0.png,595.18,False,True,videos/zz1br1_Who_should_young_men_look_up_to/final.mp4
zzb29h,We are now in the dark age of tech,/__w/ttsvibelounge/ttsvibelounge/videos/zzb29h_We_are_now_in_the_dark_age_of_tech/thumbnail_0.png,588.73,False,True,videos/zzb29h_We_are_now_in_the_dark_age_of_tech/final.mp4
zzh36i,Is there a way to mute the words  Andrew Tate  and  Greta  on Reddit?,/__w/ttsvibelounge/ttsvibelounge/videos/zzh36i_Is_there_a_way_to_mute_the_words_Andrew_Tate_and_G/thumbnail_0.png,600.7100000000002,False,True,videos/zzh36i_Is_there_a_way_to_mute_the_words_Andrew_Tate_and_G/final.mp4
zzui88,What do we need to stop teaching the children?,/__w/ttsvibelounge/ttsvibelounge/videos/zzui88_What_do_we_need_to_stop_teaching_the_children/thumbnail_0.png,588.4700000000001,False,True,videos/zzui88_What_do_we_need_to_stop_teaching_the_children/final.mp4
10034fk,What Company would you Like to Go Bankrupt?,/__w/ttsvibelounge/ttsvibelounge/videos/10034fk_What_Company_would_you_Like_to_Go_Bankrupt/thumbnail_0.png,509.5100000000001,False,True,videos/10034fk_What_Company_would_you_Like_to_Go_Bankrupt/final.mp4
zzuimq,What strange events have gotten swept under the rug over the past year like they didn't even happen?,/__w/ttsvibelounge/ttsvibelounge/videos/zzuimq_What_strange_events_have_gotten_swept_under_the_ru/thumbnail_0.png,597.0900000000001,False,True,videos/zzuimq_What_strange_events_have_gotten_swept_under_the_ru/final.mp4
zzmar5,Can’t respect people by sharing their photos without consent? You won’t get to share anymore,/__w/ttsvibelounge/ttsvibelounge/videos/zzmar5_Cant_respect_people_by_sharing_their_photos_withou/thumbnail_0.png,596.1499999999997,False,True,videos/zzmar5_Cant_respect_people_by_sharing_their_photos_withou/final.mp4
100dot4,"Water, lemons and sugar are free at restaurants but lemonade costs money.",/__w/ttsvibelounge/ttsvibelounge/videos/100dot4_Water_lemons_and_sugar_are_free_at_restaurants_but/thumbnail_0.png,595.71,False,True,videos/100dot4_Water_lemons_and_sugar_are_free_at_restaurants_but/final.mp4
100w1vm,What food can f ck right off?,/__w/ttsvibelounge/ttsvibelounge/videos/100w1vm_What_food_can_fck_right_off/thumbnail_0.png,367.8399999999999,False,True,videos/100w1vm_What_food_can_fck_right_off/final.mp4
1014kt9,"Who should be in prison 100 , but they aren't because they are rich?",/__w/ttsvibelounge/ttsvibelounge/videos/1014kt9_Who_should_be_in_prison_100_but_they_arent_because/thumbnail_0.png,587.4599999999998,False,True,videos/1014kt9_Who_should_be_in_prison_100_but_they_arent_because/final.mp4
101kh2j,"Boys be honest, what makes a girl instantly unattractive?",/__w/ttsvibelounge/ttsvibelounge/videos/101kh2j_Boys_be_honest_what_makes_a_girl_instantly_unattra/thumbnail_0.png,599.57,False,True,videos/101kh2j_Boys_be_honest_what_makes_a_girl_instantly_unattra/final.mp4
10120aq,Neg me? Enjoy your booze less New Year  ,/__w/ttsvibelounge/ttsvibelounge/videos/10120aq_Neg_me_Enjoy_your_boozeless_New_Year/thumbnail_0.png,485.13000000000005,False,True,videos/10120aq_Neg_me_Enjoy_your_boozeless_New_Year/final.mp4
101moeq,You don’t have to raise your hand when knocking on the door.,/__w/ttsvibelounge/ttsvibelounge/videos/101moeq_You_dont_have_to_raise_your_hand_when_knocking_on_/thumbnail_0.png,597.1,False,True,videos/101moeq_You_dont_have_to_raise_your_hand_when_knocking_on_/final.mp4
101lmcf,what is something you can't believe people like?,/__w/ttsvibelounge/ttsvibelounge/videos/101lmcf_what_is_something_you_cant_believe_people_like/thumbnail_0.png,595.9499999999999,False,True,videos/101lmcf_what_is_something_you_cant_believe_people_like/final.mp4
102e7pv,"broke up with a guy ten years ago, his wife contacted me a week ago",/__w/ttsvibelounge/ttsvibelounge/videos/102e7pv_broke_up_with_a_guy_ten_years_ago_his_wife_contact/thumbnail_0.png,587.3,False,True,videos/102e7pv_broke_up_with_a_guy_ten_years_ago_his_wife_contact/final.mp4
102bgtx,Cover letters are stupid and should stop being expected.,/__w/ttsvibelounge/ttsvibelounge/videos/102bgtx_Cover_letters_are_stupid_and_should_stop_being_exp/thumbnail_0.png,597.9599999999999,False,True,videos/102bgtx_Cover_letters_are_stupid_and_should_stop_being_exp/final.mp4
1025m0g,"People of reddit, what do you mis about the Covid lockdown period?",/__w/ttsvibelounge/ttsvibelounge/videos/1025m0g_People_of_reddit_what_do_you_mis_about_the_Covid_l/thumbnail_0.png,593.8599999999998,False,True,videos/1025m0g_People_of_reddit_what_do_you_mis_about_the_Covid_l/final.mp4
104cpns,What's 100  a scam but we accepted it in our society?,/__w/ttsvibelounge/ttsvibelounge/videos/104cpns_Whats_100_a_scam_but_we_accepted_it_in_our_society/thumbnail_0.png,449.5400000000001,False,True,videos/104cpns_Whats_100_a_scam_but_we_accepted_it_in_our_society/final.mp4
103zx6n,what's something you've never tried and never will?,/__w/ttsvibelounge/ttsvibelounge/videos/103zx6n_whats_something_youve_never_tried_and_never_will/thumbnail_0.png,420.91,False,True,videos/103zx6n_whats_something_youve_never_tried_and_never_will/final.mp4
104c1bn,History’s most successful criminals will never go down in history.,/__w/ttsvibelounge/ttsvibelounge/videos/104c1bn_Historys_most_successful_criminals_will_never_go_d/thumbnail_0.png,583.32,False,True,videos/104c1bn_Historys_most_successful_criminals_will_never_go_d/final.mp4
104ojta,"45  of women will be single, childless  and probably happier for it  by 2030",/__w/ttsvibelounge/ttsvibelounge/videos/104ojta_45_of_women_will_be_single_childless_and_probably_/thumbnail_0.png,593.05,False,True,videos/104ojta_45_of_women_will_be_single_childless_and_probably_/final.mp4
104whpu,Anytime an allergy is mentioned in a movie that person usually gets killed or poisoned with it,/__w/ttsvibelounge/ttsvibelounge/videos/104whpu_Anytime_an_allergy_is_mentioned_in_a_movie_that_pe/thumbnail_0.png,588.65,False,True,videos/104whpu_Anytime_an_allergy_is_mentioned_in_a_movie_that_pe/final.mp4
10520yf,"If band names were literal, what would be the best worst concerts to attend?",/__w/ttsvibelounge/ttsvibelounge/videos/10520yf_If_band_names_were_literal_what_would_be_the_bestw/thumbnail_0.png,543.6600000000002,False,True,videos/10520yf_If_band_names_were_literal_what_would_be_the_bestw/final.mp4
104zbzx,overheard salesman say i wasnt gonna buy anything made sure to have manger take my sale,/__w/ttsvibelounge/ttsvibelounge/videos/104zbzx_overheard_salesman_say_i_wasnt_gonna_buy_anything_/thumbnail_0.png,599.72,False,True,videos/104zbzx_overheard_salesman_say_i_wasnt_gonna_buy_anything_/final.mp4
105p6uh,To the woman in apartment 401,/__w/ttsvibelounge/ttsvibelounge/videos/105p6uh_To_the_woman_in_apartment_401/thumbnail_0.png,260.79,False,True,videos/105p6uh_To_the_woman_in_apartment_401/final.mp4
1061sre,"People who don’t exercise or workout, why don’t you?",/__w/ttsvibelounge/ttsvibelounge/videos/1061sre_People_who_dont_exercise_or_workout_why_dont_you/thumbnail_0.png,588.8400000000001,False,True,videos/1061sre_People_who_dont_exercise_or_workout_why_dont_you/final.mp4
105vdeq,Loving animals is NOT a sign someone is a good person.,/__w/ttsvibelounge/ttsvibelounge/videos/105vdeq_Loving_animals_is_NOT_a_sign_someone_is_a_good_per/thumbnail_0.png,588.4499999999999,False,True,videos/105vdeq_Loving_animals_is_NOT_a_sign_someone_is_a_good_per/final.mp4
1060nkm,What incorrect advice are men constantly given?,/__w/ttsvibelounge/ttsvibelounge/videos/1060nkm_What_incorrect_advice_are_men_constantly_given/thumbnail_0.png,594.5800000000002,False,True,videos/1060nkm_What_incorrect_advice_are_men_constantly_given/final.mp4
106i2pp,What are some red flags in an interview that reveals the job is toxic?,/__w/ttsvibelounge/ttsvibelounge/videos/106i2pp_What_are_some_red_flags_in_an_interview_that_revea/thumbnail_0.png,600.52,False,True,videos/106i2pp_What_are_some_red_flags_in_an_interview_that_revea/final.mp4
106jiza,Random things women obviously had no input in…,/__w/ttsvibelounge/ttsvibelounge/videos/106jiza_Random_things_women_obviously_had_no_input_in/thumbnail_0.png,599.52,False,True,videos/106jiza_Random_things_women_obviously_had_no_input_in/final.mp4
106uxfp,what is a part of history that we consider to be a fact is 100  fake ?,/__w/ttsvibelounge/ttsvibelounge/videos/106uxfp_what_is_a_part_of_history_that_we_consider_to_be_a/thumbnail_0.png,576.9600000000002,False,True,videos/106uxfp_what_is_a_part_of_history_that_we_consider_to_be_a/final.mp4
1072tg7,What are some places where no children should be allowed?,/__w/ttsvibelounge/ttsvibelounge/videos/1072tg7_What_are_some_places_where_no_children_should_be_a/thumbnail_0.png,502.5100000000001,False,True,videos/1072tg7_What_are_some_places_where_no_children_should_be_a/final.mp4
1074jq7,housing should not be an investment,/__w/ttsvibelounge/ttsvibelounge/videos/1074jq7_housing_should_not_be_an_investment/thumbnail_0.png,591.1999999999999,False,True,videos/1074jq7_housing_should_not_be_an_investment/final.mp4
106yrgb,A coworker would kick my lunch  seat  across the room every day at lunch and I got him back.,/__w/ttsvibelounge/ttsvibelounge/videos/106yrgb_A_coworker_would_kick_my_lunch_seat_across_the_roo/thumbnail_0.png,533.6500000000001,False,True,videos/106yrgb_A_coworker_would_kick_my_lunch_seat_across_the_roo/final.mp4
107n1kd,What's a phrase men hate hearing from women?,/__w/ttsvibelounge/ttsvibelounge/videos/107n1kd_Whats_a_phrase_men_hate_hearing_from_women/thumbnail_0.png,578.9799999999999,False,True,videos/107n1kd_Whats_a_phrase_men_hate_hearing_from_women/final.mp4
107xayi,You job is to pick the most awful actor to play James Bond. Who do you pick?,/__w/ttsvibelounge/ttsvibelounge/videos/107xayi_You_job_is_to_pick_the_most_awful_actor_to_play_Ja/thumbnail_0.png,336.21,False,True,videos/107xayi_You_job_is_to_pick_the_most_awful_actor_to_play_Ja/final.mp4
108aobr,"Want to block my driveway, officer? It's gonna be another minute or two on coffee.",/__w/ttsvibelounge/ttsvibelounge/videos/108aobr_Want_to_block_my_driveway_officer_Its_gonna_be_ano/thumbnail_0.png,592.9100000000003,False,True,videos/108aobr_Want_to_block_my_driveway_officer_Its_gonna_be_ano/final.mp4
108gtgn,"If you could experience a video game for the first time again, what would it be?",/__w/ttsvibelounge/ttsvibelounge/videos/108gtgn_If_you_could_experience_a_video_game_for_the_first/thumbnail_0.png,545.17,False,True,videos/108gtgn_If_you_could_experience_a_video_game_for_the_first/final.mp4
1096zht,What's a slang word term that drives you insane?,/__w/ttsvibelounge/ttsvibelounge/videos/1096zht_Whats_a_slang_wordterm_that_drives_you_insane/thumbnail_0.png,427.77,False,True,videos/1096zht_Whats_a_slang_wordterm_that_drives_you_insane/final.mp4
1097oh6,Moderately attractive people likely get hit on more than extremely attractive people do.,/__w/ttsvibelounge/ttsvibelounge/videos/1097oh6_Moderately_attractive_people_likely_get_hit_on_mor/thumbnail_0.png,593.9899999999998,False,True,videos/1097oh6_Moderately_attractive_people_likely_get_hit_on_mor/final.mp4
109g6nc,What's worse than being ugly?,/__w/ttsvibelounge/ttsvibelounge/videos/109g6nc_Whats_worse_than_being_ugly/thumbnail_0.png,391.25,False,True,videos/109g6nc_Whats_worse_than_being_ugly/final.mp4
109twae,Kicking your kid out as soon as they turn 18 is abusive.,/__w/ttsvibelounge/ttsvibelounge/videos/109twae_Kicking_your_kid_out_as_soon_as_they_turn_18_is_ab/thumbnail_0.png,599.7699999999999,False,True,videos/109twae_Kicking_your_kid_out_as_soon_as_they_turn_18_is_ab/final.mp4
10a53fz,What were you bullied for?,/__w/ttsvibelounge/ttsvibelounge/videos/10a53fz_What_were_you_bullied_for/thumbnail_0.png,598.45,False,True,videos/10a53fz_What_were_you_bullied_for/final.mp4
109w2pf,Company didn't hire me for the next position and now want me to train up the person they did,/__w/ttsvibelounge/ttsvibelounge/videos/109w2pf_Company_didnt_hire_me_for_the_next_position_and_no/thumbnail_0.png,590.76,False,True,videos/109w2pf_Company_didnt_hire_me_for_the_next_position_and_no/final.mp4
10axb50,What quietly went away without anyone noticing?,/__w/ttsvibelounge/ttsvibelounge/videos/10axb50_What_quietly_went_away_without_anyone_noticing/thumbnail_0.png,596.5599999999998,False,True,videos/10axb50_What_quietly_went_away_without_anyone_noticing/final.mp4
10bfxbs,"Brother's wife returns Christmas card, so I took away access to our HBOMax",/__w/ttsvibelounge/ttsvibelounge/videos/10bfxbs_Brothers_wife_returns_Christmas_card_so_I_took_awa/thumbnail_0.png,461.6699999999999,False,True,videos/10bfxbs_Brothers_wife_returns_Christmas_card_so_I_took_awa/final.mp4
10b9t8h,Elderly man grabbed my ass on the subway today.,/__w/ttsvibelounge/ttsvibelounge/videos/10b9t8h_Elderly_man_grabbed_my_ass_on_the_subway_today/thumbnail_0.png,468.59,False,True,videos/10b9t8h_Elderly_man_grabbed_my_ass_on_the_subway_today/final.mp4
10c02rt,Entitled Parker parked in my driveway so I blocked them in and got drunk all weekend.,/__w/ttsvibelounge/ttsvibelounge/videos/10c02rt_Entitled_Parker_parked_in_my_driveway_so_I_blocked/thumbnail_0.png,596.3000000000003,False,True,videos/10c02rt_Entitled_Parker_parked_in_my_driveway_so_I_blocked/final.mp4
10c6c13,The real gauge of friendship is how clean your house needs to be before they can come over.,/__w/ttsvibelounge/ttsvibelounge/videos/10c6c13_The_real_gauge_of_friendship_is_how_clean_your_hou/thumbnail_0.png,593.5500000000001,False,True,videos/10c6c13_The_real_gauge_of_friendship_is_how_clean_your_hou/final.mp4
10c99r2,What is 30 too old for?,/__w/ttsvibelounge/ttsvibelounge/videos/10c99r2_What_is_30_too_old_for/thumbnail_0.png,440.3300000000001,False,True,videos/10c99r2_What_is_30_too_old_for/final.mp4
10bv5p2,People with severe allergies shouldn’t eat out,/__w/ttsvibelounge/ttsvibelounge/videos/10bv5p2_People_with_severe_allergies_shouldnt_eat_out/thumbnail_0.png,597.88,False,True,videos/10bv5p2_People_with_severe_allergies_shouldnt_eat_out/final.mp4
10c5f7b,We’d save a lot of room burying people perpendicular to the ground above rather than parallel.,/__w/ttsvibelounge/ttsvibelounge/videos/10c5f7b_Wed_save_a_lot_of_room_burying_people_perpendicula/thumbnail_0.png,589.0200000000001,False,True,videos/10c5f7b_Wed_save_a_lot_of_room_burying_people_perpendicula/final.mp4
10cmcob,Back from college break to have nothing.,/__w/ttsvibelounge/ttsvibelounge/videos/10cmcob_Back_from_college_break_to_have_nothing/thumbnail_0.png,585.9100000000003,False,True,videos/10cmcob_Back_from_college_break_to_have_nothing/final.mp4
10c7ifm,What's the most overrated TV series of all time?,/__w/ttsvibelounge/ttsvibelounge/videos/10c7ifm_Whats_the_most_overrated_TV_series_of_all_time/thumbnail_0.png,251.08,False,True,videos/10c7ifm_Whats_the_most_overrated_TV_series_of_all_time/final.mp4
10css1q,What does no one look good wearing?,/__w/ttsvibelounge/ttsvibelounge/videos/10css1q_What_does_no_one_look_good_wearing/thumbnail_0.png,453.9299999999999,False,True,videos/10css1q_What_does_no_one_look_good_wearing/final.mp4
10d54ed,What is too expensive but shouldn't be?,/__w/ttsvibelounge/ttsvibelounge/videos/10d54ed_What_is_too_expensive_but_shouldnt_be/thumbnail_0.png,533.37,False,True,videos/10d54ed_What_is_too_expensive_but_shouldnt_be/final.mp4
10dm92h,Whats a company secret you can share now that you dont work there?,/__w/ttsvibelounge/ttsvibelounge/videos/10dm92h_Whats_a_company_secret_you_can_share_now_that_you_/thumbnail_0.png,596.46,False,True,videos/10dm92h_Whats_a_company_secret_you_can_share_now_that_you_/final.mp4
10dpx3f,Shamed by gyno for pubic hair?,/__w/ttsvibelounge/ttsvibelounge/videos/10dpx3f_Shamed_by_gyno_for_pubic_hair/thumbnail_0.png,595.86,False,True,videos/10dpx3f_Shamed_by_gyno_for_pubic_hair/final.mp4
10e1aar,Which company could go out of business tomorrow and it would be to the betterment of this world?,/__w/ttsvibelounge/ttsvibelounge/videos/10e1aar_Which_company_could_go_out_of_business_tomorrow_an/thumbnail_0.png,332.6999999999999,False,True,videos/10e1aar_Which_company_could_go_out_of_business_tomorrow_an/final.mp4
10emqzg,Just RAN out of a lunch date,/__w/ttsvibelounge/ttsvibelounge/videos/10emqzg_Just_RAN_out_of_a_lunch_date/thumbnail_0.png,589.96,False,True,videos/10emqzg_Just_RAN_out_of_a_lunch_date/final.mp4
10esk3g,"Voldemort is a very polite villain, because he respects Harry's vacations",/__w/ttsvibelounge/ttsvibelounge/videos/10esk3g_Voldemort_is_a_very_polite_villain_because_he_resp/thumbnail_0.png,357.42,False,True,videos/10esk3g_Voldemort_is_a_very_polite_villain_because_he_resp/final.mp4
10ed7nq,"There's a rise in loneliness among men today, why?",/__w/ttsvibelounge/ttsvibelounge/videos/10ed7nq_Theres_a_rise_in_loneliness_among_men_today_why/thumbnail_0.png,590.3,False,True,videos/10ed7nq_Theres_a_rise_in_loneliness_among_men_today_why/final.mp4
10f8byd,"What's the best response to  Dad, I think I'm gay ?",/__w/ttsvibelounge/ttsvibelounge/videos/10f8byd_Whats_the_best_response_to_Dad_I_think_Im_gay/thumbnail_0.png,599.19,False,True,videos/10f8byd_Whats_the_best_response_to_Dad_I_think_Im_gay/final.mp4
10ez0zl,my friend just got arrested after her work called the police to do a wellness check.,/__w/ttsvibelounge/ttsvibelounge/videos/10ez0zl_my_friend_just_got_arrested_after_her_work_called_/thumbnail_0.png,597.0900000000001,False,True,videos/10ez0zl_my_friend_just_got_arrested_after_her_work_called_/final.mp4
