id,title,thumbnail,duration,compiled,uploaded,file
yjlenk,To the men who put that they are conservatives in their dating profile ,C:\src\ttsvibelounge\videos\yjlenk_To_the_men_who_put_that_they_are_conservatives_in_\thumbnail_0.png,602.6200000000001,True,True,
yjjz2h,I wish social media never existed.,C:\src\ttsvibelounge\videos\yjjz2h_I_wish_social_media_never_existed\thumbnail_0.png,600.14,True,True,
ym1lxv,"Reddit, what's your most  I'm with the Boomers on this  opinion?",/__w/ttsvibelounge/ttsvibelounge/videos/ym1lxv_Reddit_whats_your_most_Im_with_the_Boomers_on_this/thumbnail_0.png,600.83,False,True,videos/ym1lxv_Reddit_whats_your_most_Im_with_the_Boomers_on_this/final.mp4
ym768x,"What sucks, has sucked, and always will suck?",/__w/ttsvibelounge/ttsvibelounge/videos/ym768x_What_sucks_has_sucked_and_always_will_suck/thumbnail_0.png,396.6999999999999,False,True,videos/ym768x_What_sucks_has_sucked_and_always_will_suck/final.mp4
ymcvkj,I don't like  👍  as a response to emails and messages. It feels passive aggressive to me.,/__w/ttsvibelounge/ttsvibelounge/videos/ymcvkj_I_dont_like__as_a_response_to_emails_and_messages_/thumbnail_0.png,604.1099999999999,False,True,videos/ymcvkj_I_dont_like__as_a_response_to_emails_and_messages_/final.mp4
ymnqkg,"What is awesome, has always been awesome, and will forever be awesome?",/__w/ttsvibelounge/ttsvibelounge/videos/ymnqkg_What_is_awesome_has_always_been_awesome_and_will_f/thumbnail_0.png,501.84,False,True,videos/ymnqkg_What_is_awesome_has_always_been_awesome_and_will_f/final.mp4
yn5u3w,What are you fucking sick of?,/__w/ttsvibelounge/ttsvibelounge/videos/yn5u3w_What_are_you_fucking_sick_of/thumbnail_0.png,605.57,False,True,videos/yn5u3w_What_are_you_fucking_sick_of/final.mp4
yn5u3w,What are you fucking sick of?,/__w/ttsvibelounge/ttsvibelounge/videos/yn5u3w_What_are_you_fucking_sick_of/thumbnail_0.png,604.3399999999997,False,False,videos/yn5u3w_What_are_you_fucking_sick_of/final.mp4
yn75h0,What's a movie that can be identified by one quote?,/__w/ttsvibelounge/ttsvibelounge/videos/yn75h0_Whats_a_movie_that_can_be_identified_by_one_quote/thumbnail_0.png,402.97000000000014,False,True,videos/yn75h0_Whats_a_movie_that_can_be_identified_by_one_quote/final.mp4
yn75h0,What's a movie that can be identified by one quote?,/__w/ttsvibelounge/ttsvibelounge/videos/yn75h0_Whats_a_movie_that_can_be_identified_by_one_quote/thumbnail_0.png,387.89,False,False,videos/yn75h0_Whats_a_movie_that_can_be_identified_by_one_quote/final.mp4
ynlreq,"You're Elon Musk, you just bought Reddit. How do you drive it to the ground?",/__w/ttsvibelounge/ttsvibelounge/videos/ynlreq_Youre_Elon_Musk_you_just_bought_Reddit_How_do_you_/thumbnail_0.png,322.63000000000005,False,True,videos/ynlreq_Youre_Elon_Musk_you_just_bought_Reddit_How_do_you_/final.mp4
ynwdp1,What crime are you okay with people committing?,/__w/ttsvibelounge/ttsvibelounge/videos/ynwdp1_What_crime_are_you_okay_with_people_committing/thumbnail_0.png,551.2,False,True,videos/ynwdp1_What_crime_are_you_okay_with_people_committing/final.mp4
yo3u9v,Should i let this girl know the real reason why i don't want to date her,/__w/ttsvibelounge/ttsvibelounge/videos/yo3u9v_Should_i_let_this_girl_know_the_real_reason_why_i_/thumbnail_0.png,608.25,False,True,videos/yo3u9v_Should_i_let_this_girl_know_the_real_reason_why_i_/final.mp4
yo3u9v,Should i let this girl know the real reason why i don't want to date her,/__w/ttsvibelounge/ttsvibelounge/videos/yo3u9v_Should_i_let_this_girl_know_the_real_reason_why_i_/thumbnail_0.png,600.1400000000001,False,False,videos/yo3u9v_Should_i_let_this_girl_know_the_real_reason_why_i_/final.mp4
yoisia,What should be illegal to put ketchup on?,/__w/ttsvibelounge/ttsvibelounge/videos/yoisia_What_should_be_illegal_to_put_ketchup_on/thumbnail_0.png,382.33,False,True,videos/yoisia_What_should_be_illegal_to_put_ketchup_on/final.mp4
yostd4,People DESPERATELY need to re learn how to have nuanced opinions.,/__w/ttsvibelounge/ttsvibelounge/videos/yostd4_People_DESPERATELY_need_to_relearn_how_to_have_nua/thumbnail_0.png,599.6499999999997,False,True,videos/yostd4_People_DESPERATELY_need_to_relearn_how_to_have_nua/final.mp4
yp1hys,What  joke  with your SO landed you in the  dog house ?,/__w/ttsvibelounge/ttsvibelounge/videos/yp1hys_What_joke_with_your_SO_landed_you_in_the_dog_house/thumbnail_0.png,584.8300000000003,False,True,videos/yp1hys_What_joke_with_your_SO_landed_you_in_the_dog_house/final.mp4
yp2dyd,My dad is kicking me out. I'm leaving a gift.,/__w/ttsvibelounge/ttsvibelounge/videos/yp2dyd_My_dad_is_kicking_me_out_Im_leaving_a_gift/thumbnail_0.png,597.5099999999999,False,True,videos/yp2dyd_My_dad_is_kicking_me_out_Im_leaving_a_gift/final.mp4
yg8dn7,What sound most annoys you?,/__w/ttsvibelounge/ttsvibelounge/videos/yg8dn7_What_sound_most_annoys_you/thumbnail_0.png,584.6100000000002,False,True,videos/yg8dn7_What_sound_most_annoys_you/final.mp4
yoq29r,Why does a majority of Reddit hate landlords.,/__w/ttsvibelounge/ttsvibelounge/videos/yoq29r_Why_does_a_majority_of_Reddit_hate_landlords/thumbnail_0.png,590.2799999999999,False,True,videos/yoq29r_Why_does_a_majority_of_Reddit_hate_landlords/final.mp4
ypodkx,my coworker has the system beat and they can't do anything to fire him,/__w/ttsvibelounge/ttsvibelounge/videos/ypodkx_my_coworker_has_the_system_beat_and_they_cant_do_a/thumbnail_0.png,592.5300000000001,False,True,videos/ypodkx_my_coworker_has_the_system_beat_and_they_cant_do_a/final.mp4
ypzw23,Powerball billionaires are probably way better for the economy than traditional billionaires,/__w/ttsvibelounge/ttsvibelounge/videos/ypzw23_Powerball_billionaires_are_probably_way_better_for/thumbnail_0.png,581.39,False,True,videos/ypzw23_Powerball_billionaires_are_probably_way_better_for/final.mp4
ypu67r,What’s a hill you’re willing to die on every time?,/__w/ttsvibelounge/ttsvibelounge/videos/ypu67r_Whats_a_hill_youre_willing_to_die_on_every_time/thumbnail_0.png,598.7199999999998,False,True,videos/ypu67r_Whats_a_hill_youre_willing_to_die_on_every_time/final.mp4
yq5f4j,I had decided not to vote today.,/__w/ttsvibelounge/ttsvibelounge/videos/yq5f4j_I_had_decided_not_to_vote_today/thumbnail_0.png,598.8900000000001,False,True,videos/yq5f4j_I_had_decided_not_to_vote_today/final.mp4
ypw73g,What’s an unspoken rule of Reddit?,/__w/ttsvibelounge/ttsvibelounge/videos/ypw73g_Whats_an_unspoken_rule_of_Reddit/thumbnail_0.png,576.3100000000003,False,True,videos/ypw73g_Whats_an_unspoken_rule_of_Reddit/final.mp4
ypjkkt,Vote today. Vote for the rights to our own bodies.,/__w/ttsvibelounge/ttsvibelounge/videos/ypjkkt_Vote_today_Vote_for_the_rights_to_our_own_bodies/thumbnail_0.png,597.13,False,True,videos/ypjkkt_Vote_today_Vote_for_the_rights_to_our_own_bodies/final.mp4
yq3tsj,Guy potentially ruined his life for telling me to kill myself,/__w/ttsvibelounge/ttsvibelounge/videos/yq3tsj_Guy_potentially_ruined_his_life_for_telling_me_to_/thumbnail_0.png,590.2299999999998,False,True,videos/yq3tsj_Guy_potentially_ruined_his_life_for_telling_me_to_/final.mp4
yqmtb4,What famous musicians can’t play their instruments?,/__w/ttsvibelounge/ttsvibelounge/videos/yqmtb4_What_famous_musicians_cant_play_their_instruments/thumbnail_0.png,424.09,False,True,videos/yqmtb4_What_famous_musicians_cant_play_their_instruments/final.mp4
yqjoxr,"Left gas stove on last night without a flame overnight, should we evacuate?",/__w/ttsvibelounge/ttsvibelounge/videos/yqjoxr_Left_gas_stove_on_last_night_without_a_flame_overn/thumbnail_0.png,589.5900000000001,False,True,videos/yqjoxr_Left_gas_stove_on_last_night_without_a_flame_overn/final.mp4
yr2c44,What tastes better a little burnt?,/__w/ttsvibelounge/ttsvibelounge/videos/yr2c44_What_tastes_better_a_little_burnt/thumbnail_0.png,388.85,False,True,videos/yr2c44_What_tastes_better_a_little_burnt/final.mp4
yr3wl7,What’s a movie that genuinely had you bawling with laughter??,/__w/ttsvibelounge/ttsvibelounge/videos/yr3wl7_Whats_a_movie_that_genuinely_had_you_bawling_with_/thumbnail_0.png,285.13,False,True,videos/yr3wl7_Whats_a_movie_that_genuinely_had_you_bawling_with_/final.mp4
yqtw0f,"Men, what annoys YOU about other men?",/__w/ttsvibelounge/ttsvibelounge/videos/yqtw0f_Men_what_annoys_YOU_about_other_men/thumbnail_0.png,577.18,False,True,videos/yqtw0f_Men_what_annoys_YOU_about_other_men/final.mp4
yreafz,"You wanna see me poop? Sure buddy, I would extend the same courtesy as well",/__w/ttsvibelounge/ttsvibelounge/videos/yreafz_You_wanna_see_me_poop_Sure_buddy_I_would_extend_th/thumbnail_0.png,578.5500000000002,False,True,videos/yreafz_You_wanna_see_me_poop_Sure_buddy_I_would_extend_th/final.mp4
yrrmgy,Block my driveway? I don't know where your car went.,/__w/ttsvibelounge/ttsvibelounge/videos/yrrmgy_Block_my_driveway_I_dont_know_where_your_car_went/thumbnail_0.png,581.19,False,True,videos/yrrmgy_Block_my_driveway_I_dont_know_where_your_car_went/final.mp4
ys7fe6,Today I learned what weaponised incompetence is and realised what I was going rheough with my ex,/__w/ttsvibelounge/ttsvibelounge/videos/ys7fe6_Today_I_learned_what_weaponised_incompetence_is_an/thumbnail_0.png,596.53,False,True,videos/ys7fe6_Today_I_learned_what_weaponised_incompetence_is_an/final.mp4
ysb115,I break my spaghetti and you can’t stop me,/__w/ttsvibelounge/ttsvibelounge/videos/ysb115_I_break_my_spaghetti_and_you_cant_stop_me/thumbnail_0.png,591.8,False,True,videos/ysb115_I_break_my_spaghetti_and_you_cant_stop_me/final.mp4
ysj9ux,What is the worst feeling ever?,/__w/ttsvibelounge/ttsvibelounge/videos/ysj9ux_What_is_the_worst_feeling_ever/thumbnail_0.png,592.2900000000001,False,True,videos/ysj9ux_What_is_the_worst_feeling_ever/final.mp4
yse8ra,Whats the equivalent of  dude  for a girl ?,/__w/ttsvibelounge/ttsvibelounge/videos/yse8ra_Whats_the_equivalent_of_dude_for_a_girl_/thumbnail_0.png,429.5999999999999,False,True,videos/yse8ra_Whats_the_equivalent_of_dude_for_a_girl_/final.mp4
ysxh0f,Bizarre reaction to me agreeing with him?,/__w/ttsvibelounge/ttsvibelounge/videos/ysxh0f_Bizarre_reaction_to_me_agreeing_with_him/thumbnail_0.png,594.1099999999999,False,True,videos/ysxh0f_Bizarre_reaction_to_me_agreeing_with_him/final.mp4
ytgdqx,What truly has a 0  chance of happening?,/__w/ttsvibelounge/ttsvibelounge/videos/ytgdqx_What_truly_has_a_0_chance_of_happening/thumbnail_0.png,286.73,False,True,videos/ytgdqx_What_truly_has_a_0_chance_of_happening/final.mp4
ythbfi,What is the first thing you think of when you think about the American South?,/__w/ttsvibelounge/ttsvibelounge/videos/ythbfi_What_is_the_first_thing_you_think_of_when_you_thin/thumbnail_0.png,405.78,False,True,videos/ythbfi_What_is_the_first_thing_you_think_of_when_you_thin/final.mp4
ytpsjp,Getting very drunk is way more fun than being very drunk,/__w/ttsvibelounge/ttsvibelounge/videos/ytpsjp_Getting_very_drunk_is_way_more_fun_than_being_very/thumbnail_0.png,503.0900000000001,False,True,videos/ytpsjp_Getting_very_drunk_is_way_more_fun_than_being_very/final.mp4
ytlpm9,"Women of Reddit , what’s one thing all men should know about periods?",/__w/ttsvibelounge/ttsvibelounge/videos/ytlpm9_Women_of_Reddit__whats_one_thing_all_men_should_kn/thumbnail_0.png,589.87,False,True,videos/ytlpm9_Women_of_Reddit__whats_one_thing_all_men_should_kn/final.mp4
yu87iw,what song hits different after you read the lyrics?,/__w/ttsvibelounge/ttsvibelounge/videos/yu87iw_what_song_hits_different_after_you_read_the_lyrics/thumbnail_0.png,600.0999999999999,False,True,videos/yu87iw_what_song_hits_different_after_you_read_the_lyrics/final.mp4
yuibit,What job contributes nothing to society?,/__w/ttsvibelounge/ttsvibelounge/videos/yuibit_What_job_contributes_nothing_to_society/thumbnail_0.png,482.2299999999998,False,True,videos/yuibit_What_job_contributes_nothing_to_society/final.mp4
yun3j6,Don’t use me to parent your kids.,/__w/ttsvibelounge/ttsvibelounge/videos/yun3j6_Dont_use_me_to_parent_your_kids/thumbnail_0.png,581.66,False,True,videos/yun3j6_Dont_use_me_to_parent_your_kids/final.mp4
yulcks,"Im starting to believe professional sports, specifically NFL are predetermined scripted.",/__w/ttsvibelounge/ttsvibelounge/videos/yulcks_Im_starting_to_believe_professional_sports_specifi/thumbnail_0.png,596.81,False,True,videos/yulcks_Im_starting_to_believe_professional_sports_specifi/final.mp4
yvbfn2,What's the most overrated drink ?,/__w/ttsvibelounge/ttsvibelounge/videos/yvbfn2_Whats_the_most_overrated_drink_/thumbnail_0.png,213.38,False,True,videos/yvbfn2_Whats_the_most_overrated_drink_/final.mp4
yv84ac,Mass Executions in Iran,/__w/ttsvibelounge/ttsvibelounge/videos/yv84ac_Mass_Executions_in_Iran/thumbnail_0.png,314.73,False,True,videos/yv84ac_Mass_Executions_in_Iran/final.mp4
yv5z85,What Pseudo  Fact  Do You Wish People Would Stop Using?,/__w/ttsvibelounge/ttsvibelounge/videos/yv5z85_What_Pseudo_Fact_Do_You_Wish_People_Would_Stop_Usi/thumbnail_0.png,598.0199999999999,False,True,videos/yv5z85_What_Pseudo_Fact_Do_You_Wish_People_Would_Stop_Usi/final.mp4
yvxhc3,What’s the one thing you would never buy second hand?,/__w/ttsvibelounge/ttsvibelounge/videos/yvxhc3_Whats_the_one_thing_you_would_never_buy_second_han/thumbnail_0.png,345.76,False,True,videos/yvxhc3_Whats_the_one_thing_you_would_never_buy_second_han/final.mp4
yw04s8,Good drivers miss their turns more often than bad drivers.,/__w/ttsvibelounge/ttsvibelounge/videos/yw04s8_Good_drivers_miss_their_turns_more_often_than_bad_/thumbnail_0.png,598.66,False,True,videos/yw04s8_Good_drivers_miss_their_turns_more_often_than_bad_/final.mp4
ywemuo,"Americans of Reddit, what is the worst big city in the USA and why?",/__w/ttsvibelounge/ttsvibelounge/videos/ywemuo_Americans_of_Reddit_what_is_the_worst_big_city_in_/thumbnail_0.png,599.16,False,True,videos/ywemuo_Americans_of_Reddit_what_is_the_worst_big_city_in_/final.mp4
yw5erp,Is it ok for a woman to have the final say where her male partner finishes?,/__w/ttsvibelounge/ttsvibelounge/videos/yw5erp_Is_it_ok_for_a_woman_to_have_the_final_say_where_h/thumbnail_0.png,589.68,False,True,videos/yw5erp_Is_it_ok_for_a_woman_to_have_the_final_say_where_h/final.mp4
ywgfnw,"In prison, what are crimes that even criminals hate you for?",/__w/ttsvibelounge/ttsvibelounge/videos/ywgfnw_In_prison_what_are_crimes_that_even_criminals_hate/thumbnail_0.png,600.4300000000001,False,True,videos/ywgfnw_In_prison_what_are_crimes_that_even_criminals_hate/final.mp4
ywjwj1,"What is a show you hate, that every one loves?",/__w/ttsvibelounge/ttsvibelounge/videos/ywjwj1_What_is_a_show_you_hate_that_every_one_loves/thumbnail_0.png,432.12,False,True,videos/ywjwj1_What_is_a_show_you_hate_that_every_one_loves/final.mp4
yxa8k1,what's an addiction that no one takes seriously enough?,/__w/ttsvibelounge/ttsvibelounge/videos/yxa8k1_whats_an_addiction_that_no_one_takes_seriously_eno/thumbnail_0.png,572.7900000000002,False,True,videos/yxa8k1_whats_an_addiction_that_no_one_takes_seriously_eno/final.mp4
yxd6gl,I found out my husband and dearest friend were having an affair,/__w/ttsvibelounge/ttsvibelounge/videos/yxd6gl_I_found_out_my_husband_and_dearest_friend_were_hav/thumbnail_0.png,597.8799999999999,False,True,videos/yxd6gl_I_found_out_my_husband_and_dearest_friend_were_hav/final.mp4
yxbrb0,why do people shame men for not knowing female products?,/__w/ttsvibelounge/ttsvibelounge/videos/yxbrb0_why_do_people_shame_men_for_not_knowing_female_pro/thumbnail_0.png,598.1700000000001,False,True,videos/yxbrb0_why_do_people_shame_men_for_not_knowing_female_pro/final.mp4
yxxs30,Who had the biggest fall from grace in history?,/__w/ttsvibelounge/ttsvibelounge/videos/yxxs30_Who_had_the_biggest_fall_from_grace_in_history/thumbnail_0.png,540.5600000000002,False,True,videos/yxxs30_Who_had_the_biggest_fall_from_grace_in_history/final.mp4
yxsbz2,"People in the USA who still display a confederate flag, why?",/__w/ttsvibelounge/ttsvibelounge/videos/yxsbz2_People_in_the_USA_who_still_display_a_confederate_/thumbnail_0.png,576.9999999999999,False,True,videos/yxsbz2_People_in_the_USA_who_still_display_a_confederate_/final.mp4
yybjxf,What job seems to attract assholes?,/__w/ttsvibelounge/ttsvibelounge/videos/yybjxf_What_job_seems_to_attract_assholes/thumbnail_0.png,525.6499999999999,False,True,videos/yybjxf_What_job_seems_to_attract_assholes/final.mp4
yy4ohy,Nothing last longer than that video someone showing you that you have no interest in.,/__w/ttsvibelounge/ttsvibelounge/videos/yy4ohy_Nothing_last_longer_than_that_video_someone_showin/thumbnail_0.png,589.5699999999999,False,True,videos/yy4ohy_Nothing_last_longer_than_that_video_someone_showin/final.mp4
yypdl4,Drank a beer so I wouldnt be forced to babysit for my aunt,/__w/ttsvibelounge/ttsvibelounge/videos/yypdl4_Drank_a_beer_so_I_wouldnt_be_forced_to_babysit_for/thumbnail_0.png,600.2700000000001,False,True,videos/yypdl4_Drank_a_beer_so_I_wouldnt_be_forced_to_babysit_for/final.mp4
yypdo3,For most of human history everyone constantly smelled like a campfire,/__w/ttsvibelounge/ttsvibelounge/videos/yypdo3_For_most_of_human_history_everyone_constantly_smel/thumbnail_0.png,402.16,False,True,videos/yypdo3_For_most_of_human_history_everyone_constantly_smel/final.mp4
yyz6ox,"You wake up as Joe Biden, what’s your first move?",/__w/ttsvibelounge/ttsvibelounge/videos/yyz6ox_You_wake_up_as_Joe_Biden_whats_your_first_move/thumbnail_0.png,475.68,False,True,videos/yyz6ox_You_wake_up_as_Joe_Biden_whats_your_first_move/final.mp4
yykuex,What are your thoughts on twitter shutting down?,/__w/ttsvibelounge/ttsvibelounge/videos/yykuex_What_are_your_thoughts_on_twitter_shutting_down/thumbnail_0.png,308.19,False,True,videos/yykuex_What_are_your_thoughts_on_twitter_shutting_down/final.mp4
yzcq71,Where does the stereotype  Asians eat cats and dogs  come from?,/__w/ttsvibelounge/ttsvibelounge/videos/yzcq71_Where_does_the_stereotype_Asians_eat_cats_and_dogs/thumbnail_0.png,600.54,False,True,videos/yzcq71_Where_does_the_stereotype_Asians_eat_cats_and_dogs/final.mp4
yzp591,"If there was a vote for one person to receive immortality, who would win?",/__w/ttsvibelounge/ttsvibelounge/videos/yzp591_If_there_was_a_vote_for_one_person_to_receive_immo/thumbnail_0.png,497.16,False,True,videos/yzp591_If_there_was_a_vote_for_one_person_to_receive_immo/final.mp4
yzoy12,Husband just told me its over,/__w/ttsvibelounge/ttsvibelounge/videos/yzoy12_Husband_just_told_me_its_over/thumbnail_0.png,593.8699999999999,False,True,videos/yzoy12_Husband_just_told_me_its_over/final.mp4
yzq54l,Steal my groceries? I’ll steal your pizza.,/__w/ttsvibelounge/ttsvibelounge/videos/yzq54l_Steal_my_groceries_Ill_steal_your_pizza/thumbnail_0.png,596.0899999999997,False,True,videos/yzq54l_Steal_my_groceries_Ill_steal_your_pizza/final.mp4
z085yo,Why isn't everyone boycotting the World Cup?,/__w/ttsvibelounge/ttsvibelounge/videos/z085yo_Why_isnt_everyone_boycotting_the_World_Cup/thumbnail_0.png,600.1799999999998,False,True,videos/z085yo_Why_isnt_everyone_boycotting_the_World_Cup/final.mp4
z0lt22,Who is one celebrity nobody hates?,/__w/ttsvibelounge/ttsvibelounge/videos/z0lt22_Who_is_one_celebrity_nobody_hates/thumbnail_0.png,287.0899999999998,False,True,videos/z0lt22_Who_is_one_celebrity_nobody_hates/final.mp4
z0ynvz,People should be able to complain about the homeless without criticism,/__w/ttsvibelounge/ttsvibelounge/videos/z0ynvz_People_should_be_able_to_complain_about_the_homele/thumbnail_0.png,590.5400000000001,False,True,videos/z0ynvz_People_should_be_able_to_complain_about_the_homele/final.mp4
z11z2q,How did you find out you were getting cheated on?,/__w/ttsvibelounge/ttsvibelounge/videos/z11z2q_How_did_you_find_out_you_were_getting_cheated_on/thumbnail_0.png,592.51,False,True,videos/z11z2q_How_did_you_find_out_you_were_getting_cheated_on/final.mp4
z1l0m4,What was the saddest fictional character death for you?,/__w/ttsvibelounge/ttsvibelounge/videos/z1l0m4_What_was_the_saddest_fictional_character_death_for/thumbnail_0.png,595.8100000000002,False,True,videos/z1l0m4_What_was_the_saddest_fictional_character_death_for/final.mp4
z1dpri,There’s no practical difference between 3 urinals and 4,/__w/ttsvibelounge/ttsvibelounge/videos/z1dpri_Theres_no_practical_difference_between_3_urinals_a/thumbnail_0.png,598.57,False,True,videos/z1dpri_Theres_no_practical_difference_between_3_urinals_a/final.mp4
z1vxpz,"What’s something expensive, you thought was cheap when you were a kid?",/__w/ttsvibelounge/ttsvibelounge/videos/z1vxpz_Whats_something_expensive_you_thought_was_cheap_wh/thumbnail_0.png,582.0599999999998,False,True,videos/z1vxpz_Whats_something_expensive_you_thought_was_cheap_wh/final.mp4
z20ofn,My neighbors wouldn’t stop smoking on the balcony. I bought a super soaker.,/__w/ttsvibelounge/ttsvibelounge/videos/z20ofn_My_neighbors_wouldnt_stop_smoking_on_the_balcony_I/thumbnail_0.png,597.4399999999998,False,True,videos/z20ofn_My_neighbors_wouldnt_stop_smoking_on_the_balcony_I/final.mp4
z34957,What is the greatest film trilogy of all time?,/__w/ttsvibelounge/ttsvibelounge/videos/z34957_What_is_the_greatest_film_trilogy_of_all_time/thumbnail_0.png,231.93,False,True,videos/z34957_What_is_the_greatest_film_trilogy_of_all_time/final.mp4
z2m807,The ad for the first tv with colors must’ve been in black and white.,/__w/ttsvibelounge/ttsvibelounge/videos/z2m807_The_ad_for_the_first_tv_with_colors_mustve_been_in/thumbnail_0.png,596.6499999999999,False,True,videos/z2m807_The_ad_for_the_first_tv_with_colors_mustve_been_in/final.mp4
z3is4d,What things do Americans like and the rest of the world not so much?,/__w/ttsvibelounge/ttsvibelounge/videos/z3is4d_What_things_do_Americans_like_and_the_rest_of_the_/thumbnail_0.png,421.3999999999999,False,True,videos/z3is4d_What_things_do_Americans_like_and_the_rest_of_the_/final.mp4
z3oc17,"If you shop on the day of thanksgiving, you're a horrible person",/__w/ttsvibelounge/ttsvibelounge/videos/z3oc17_If_you_shop_on_the_day_of_thanksgiving_youre_a_hor/thumbnail_0.png,594.8399999999999,False,True,videos/z3oc17_If_you_shop_on_the_day_of_thanksgiving_youre_a_hor/final.mp4
z3uzhi,What ruined your Thanksgiving this year?,/__w/ttsvibelounge/ttsvibelounge/videos/z3uzhi_What_ruined_your_Thanksgiving_this_year/thumbnail_0.png,594.75,False,True,videos/z3uzhi_What_ruined_your_Thanksgiving_this_year/final.mp4
z40utz,What did the pandemic ruin more than we realise?,/__w/ttsvibelounge/ttsvibelounge/videos/z40utz_What_did_the_pandemic_ruin_more_than_we_realise/thumbnail_0.png,592.8799999999999,False,True,videos/z40utz_What_did_the_pandemic_ruin_more_than_we_realise/final.mp4
z3x5k1,Won’t call me by my name? You get a new one ,/__w/ttsvibelounge/ttsvibelounge/videos/z3x5k1_Wont_call_me_by_my_name_You_get_a_new_one/thumbnail_0.png,589.76,False,True,videos/z3x5k1_Wont_call_me_by_my_name_You_get_a_new_one/final.mp4
z4dkea,Who was actually the worst President ever?,/__w/ttsvibelounge/ttsvibelounge/videos/z4dkea_Who_was_actually_the_worst_President_ever/thumbnail_0.png,464.08,False,True,videos/z4dkea_Who_was_actually_the_worst_President_ever/final.mp4
z4pq24,What celebrity death was the most unexpected?,/__w/ttsvibelounge/ttsvibelounge/videos/z4pq24_What_celebrity_death_was_the_most_unexpected/thumbnail_0.png,589.1800000000001,False,True,videos/z4pq24_What_celebrity_death_was_the_most_unexpected/final.mp4
z4wbcb,What’s the best cartoon show of all time ?,/__w/ttsvibelounge/ttsvibelounge/videos/z4wbcb_Whats_the_best_cartoon_show_of_all_time_/thumbnail_0.png,280.7299999999999,False,True,videos/z4wbcb_Whats_the_best_cartoon_show_of_all_time_/final.mp4
z4lmg9,"Man to man, what is one sentence a woman told you that is still stuck in your head until this day?",/__w/ttsvibelounge/ttsvibelounge/videos/z4lmg9_Man_to_man_what_is_one_sentence_a_woman_told_you_t/thumbnail_0.png,579.9,False,True,videos/z4lmg9_Man_to_man_what_is_one_sentence_a_woman_told_you_t/final.mp4
z50jt9,"My cheating BF of 8 years likes to go through my stuff. Careful what you might find, stud.",/__w/ttsvibelounge/ttsvibelounge/videos/z50jt9_My_cheating_BF_of_8_years_likes_to_go_through_my_s/thumbnail_0.png,599.78,False,True,videos/z50jt9_My_cheating_BF_of_8_years_likes_to_go_through_my_s/final.mp4
z5neg5,What TV show never had a decline in quality?,/__w/ttsvibelounge/ttsvibelounge/videos/z5neg5_What_TV_show_never_had_a_decline_in_quality/thumbnail_0.png,362.57,False,True,videos/z5neg5_What_TV_show_never_had_a_decline_in_quality/final.mp4
z5pkgk,Who got away with murder that should be in prison right now?,/__w/ttsvibelounge/ttsvibelounge/videos/z5pkgk_Who_got_away_with_murder_that_should_be_in_prison_/thumbnail_0.png,599.48,False,True,videos/z5pkgk_Who_got_away_with_murder_that_should_be_in_prison_/final.mp4
z5w506,American weddings are an expensive vanity party and a terrible tradition,/__w/ttsvibelounge/ttsvibelounge/videos/z5w506_American_weddings_are_an_expensive_vanity_party_an/thumbnail_0.png,582.6100000000004,False,True,videos/z5w506_American_weddings_are_an_expensive_vanity_party_an/final.mp4
z66tpk,What would your reaction be if your partner told you  I’ll marry you if you lose weight ?,/__w/ttsvibelounge/ttsvibelounge/videos/z66tpk_What_would_your_reaction_be_if_your_partner_told_y/thumbnail_0.png,584.0099999999999,False,True,videos/z66tpk_What_would_your_reaction_be_if_your_partner_told_y/final.mp4
z6au7w,"Of fictional clowns, Ronald McDonald has a much higher body count than The Joker.",/__w/ttsvibelounge/ttsvibelounge/videos/z6au7w_Of_fictional_clowns_Ronald_McDonald_has_a_much_hig/thumbnail_0.png,342.52,False,True,videos/z6au7w_Of_fictional_clowns_Ronald_McDonald_has_a_much_hig/final.mp4
z6l6xn,How much do someone's political views matter when it comes to casual dating and why?,/__w/ttsvibelounge/ttsvibelounge/videos/z6l6xn_How_much_do_someones_political_views_matter_when_i/thumbnail_0.png,588.03,False,True,videos/z6l6xn_How_much_do_someones_political_views_matter_when_i/final.mp4
